state,session,chamber,bill_id,title,created_at,updated_at,type,subjects,serialid,serial_464208c8_41a1_4999_a4ad_858be4add44b
ny,2011-2012,lower,A 3006,Provides for HIV-related testing without consent of the subject or another authorized to give consent where health care or other worker potentially endangered,2011-05-05T00:00:00,2012-10-16T00:00:00,bill,Health,3361,3360
ny,2011-2012,lower,A 3007,Requires patient hospital admissions form allow patient to designate a domestic partner with the same privileges as a next-of-kin respecting authorizing surgery,2011-05-05T00:00:00,2012-10-16T00:00:00,bill,Health,3362,3361
ny,2011-2012,lower,A 3026,Requires funeral directors to post signs relating to the benefits afforded to deceased veterans and their families,2011-05-05T00:00:00,2012-10-16T00:00:00,bill,Health,3384,3383
ny,2011-2012,lower,A 3041,Provides electronic monitoring system for functionally impaired elderly or disabled persons; appropriation,2011-05-05T00:00:00,2012-10-16T00:00:00,bill,Health,3409,3408
ny,2011-2012,lower,A 3092,Relates to the rights of former outpatients of mental health facilities to have files sealed after ten years,2011-05-05T00:00:00,2012-10-16T00:00:00,bill,Health|Legal Issues,3471,3470
ny,2011-2012,lower,A 311,Authorizes the commissioner of health to restrict the use of trans fat in foods prepared by institutions under such department's jurisdiction,2011-05-05T00:00:00,2012-10-16T00:00:00,bill,Health,3495,3494
ny,2011-2012,lower,A 3121,Provides for trichloroethylene (TCE) exposure prevention,2011-05-05T00:00:00,2012-10-16T00:00:00,bill,Health,3508,3507
ny,2011-2012,lower,A 3122,"Relates to protecting indoor air quality in state owned, leased or operated buildings",2011-05-05T00:00:00,2012-10-16T00:00:00,bill,Health,3509,3508
ny,2011-2012,lower,A 3123,Makes provisions to protect indoor air quality including indoor air quality plans by building owners and air quality standards and investigations,2011-05-05T00:00:00,2012-10-16T00:00:00,bill,Health,3510,3509
ny,2011-2012,lower,A 318,"Exempts monthly assessments due from certain residential health facilities from interest or penalties for any period prior to October 1, 2012",2011-05-05T00:00:00,2012-10-16T00:00:00,bill,Health,3583,3582
ny,2011-2012,lower,A 3191,Establishes temporary task force on developmental disabilities,2011-05-05T00:00:00,2012-10-16T00:00:00,bill,Health,3597,3596
ny,2011-2012,lower,A 3198,Provides that hospital admission registration forms include the name of school attended by school-aged patients,2011-05-05T00:00:00,2012-10-16T00:00:00,bill,Health,3604,3603
ny,2011-2012,lower,A 3199,Relates to substantial reductions by health maintenance organizations of inpatient referrals to a hospital,2011-05-05T00:00:00,2012-10-16T00:00:00,bill,Health,3605,3604
ny,2011-2012,lower,A 3206,Establishes training and registration requirements for kidney dialysis patient care technicians,2011-05-05T00:00:00,2012-10-16T00:00:00,bill,Health,3614,3613
ny,2011-2012,lower,A 3217,Directs commissioner of health and commissioner of mental retardation and developmental disabilities to require pediatric care providers to screen for autism; repealer,2011-05-05T00:00:00,2012-10-16T00:00:00,bill,Health,3626,3625
ny,2011-2012,lower,A 322,Establishes a genetics advisory council,2011-05-05T00:00:00,2012-10-16T00:00:00,bill,Health,3629,3628
ny,2011-2012,lower,A 3231,Provides for the disclosure of certain ownership information by funeral firms at their premises and in certain written materials,2011-05-05T00:00:00,2012-10-16T00:00:00,bill,Health,3646,3645
ny,2011-2012,lower,A 3248,Limits the capping of certain administrative and general costs of home care services agencies for purposes of reimbursement,2011-05-05T00:00:00,2012-10-16T00:00:00,bill,Health,3664,3663
ny,2011-2012,lower,A 3304,Relates to health-related legal services programs,2011-05-05T00:00:00,2012-10-16T00:00:00,bill,Health,3743,3742
ny,2011-2012,lower,A 3304A,Relates to health-related legal services programs,2011-05-25T00:00:00,2012-04-27T00:00:00,bill,Health,3744,3743
ny,2011-2012,lower,A 3328,Requires disclosure by crisis pregnancy centers,2011-05-05T00:00:00,2012-10-16T00:00:00,bill,Health,3771,3770
ny,2011-2012,lower,A 3329,Provides for the prohibition of sale of tobacco products at pharmacies,2011-05-05T00:00:00,2012-10-16T00:00:00,bill,Health,3772,3771
ny,2011-2012,lower,A 3338,Relates to authorizing the seizure and confinement of animals in connection with the prevention of rabies,2011-05-05T00:00:00,2012-10-16T00:00:00,bill,Health,3783,3782
ny,2011-2012,lower,A 3339,"Authorizes a physician assistant, acting under the supervision of a physician, to sign death certificates in like manner as physicians",2011-05-05T00:00:00,2012-10-16T00:00:00,bill,Health,3784,3783
ny,2011-2012,lower,A 3419,Requires persons licensed to sell alcoholic beverages for consumption on the premises to display a sign or poster on dangers of alcohol consumption while pregnant,2011-05-05T00:00:00,2012-10-16T00:00:00,bill,Health,3889,3888
ny,2011-2012,lower,A 342,Establishes a healthcare reinvestment fund suburban demonstration project,2011-05-05T00:00:00,2012-10-16T00:00:00,bill,Health,3890,3889
ny,2011-2012,lower,A 3427,Establishes the save our sight program and the save our sight fund to provide vision screening and educational information,2011-05-05T00:00:00,2012-10-16T00:00:00,bill,Health,3900,3899
ny,2011-2012,lower,A 3427A,Establishes the save our sight program and the save our sight fund to provide vision screening and educational information,2012-01-19T00:00:00,2012-05-17T00:00:00,bill,Health,3901,3900
ny,2011-2012,lower,A 342A,Establishes a healthcare reinvestment fund suburban demonstration project,2012-02-07T00:00:00,2012-05-02T00:00:00,bill,Health,3904,3903
ny,2011-2012,lower,A 343,Provides treatment for sexually transmissible diseases to minors without a parent's or guardian's consent,2011-05-05T00:00:00,2012-10-16T00:00:00,bill,Health,3905,3904
ny,2011-2012,lower,A 3430,Prohibits smoking in correctional facilities,2011-05-05T00:00:00,2012-10-16T00:00:00,bill,Health,3906,3905
ny,2011-2012,lower,A 344,Provides a premium reduction for physicians and licensed midwives who complete a risk management strategies course,2011-05-05T00:00:00,2012-10-16T00:00:00,bill,Health,3919,3918
ny,2011-2012,lower,A 3449,Establishes a voluntary confidential intermediary adoption program to search for and contact a birth parent or adopted person,2011-05-05T00:00:00,2012-10-16T00:00:00,bill,Health,3931,3930
ny,2011-2012,lower,A 344A,Provides a premium reduction for physicians and licensed midwives who complete a risk management strategies in obstetrics course,2011-05-20T00:00:00,2012-05-02T00:00:00,bill,Health,3932,3931
ny,2011-2012,lower,A 345,Establishes a forensic fellowship program for the education and training in child abuse pediatrics,2011-05-05T00:00:00,2012-10-16T00:00:00,bill,Health,3933,3932
ny,2011-2012,lower,A 3453,Directs the department of health to establish a certificate of birth resulting in stillbirth,2011-05-05T00:00:00,2012-10-16T00:00:00,bill,Health,3937,3936
ny,2011-2012,lower,A 3453A,Directs the department of health to establish a certificate of birth resulting in stillbirth,2011-05-05T00:00:00,2012-05-03T00:00:00,bill,Health,3938,3937
ny,2011-2012,lower,A 346,Amends the civil penalties authorized to be levied by local boards of health,2011-05-05T00:00:00,2012-10-16T00:00:00,bill,Health,3945,3944
ny,2011-2012,lower,A 3463,Creates the observational care unit demonstration program,2011-05-05T00:00:00,2012-10-16T00:00:00,bill,Health,3949,3948
ny,2011-2012,lower,A 3479,Directs the office of children and family services to examine the impact of children of mothers with HIV on the social services system,2011-05-05T00:00:00,2012-10-16T00:00:00,bill,Health,3967,3966
ny,2011-2012,lower,A 3919,Prevents the commissioner of mental health from considering the source of availability of state share of medical expenses as a criterion for operating certificates,2011-05-05T00:00:00,2012-10-16T00:00:00,bill,Health|Legal Issues,4533,4532
ny,2011-2012,lower,A 3945,Requires commissioners of health and general services to promulgate standards for the procurement and use of non-toxic commodities and services for hospitals,2011-05-05T00:00:00,2012-10-16T00:00:00,bill,Health,4564,4563
ny,2011-2012,lower,A 3950,Provides for the transfer of funds for use by the director of the office for the aging for geriatric education centers,2011-05-05T00:00:00,2012-10-16T00:00:00,bill,Health,4571,4570
ny,2011-2012,lower,A 3963A,Establishes standards and programs relating to the prevention and/or reduction of the incidence of hospital-acquired infections,2012-02-01T00:00:00,2012-05-08T00:00:00,bill,Health,4588,4587
ny,2011-2012,lower,A 3964A,Makes possession and sale of embalming fluid a misdemeanor,2012-01-11T00:00:00,2012-05-08T00:00:00,bill,Health,4590,4589
ny,2011-2012,lower,A 3551,Relates to referrals of patients for health related items or services,2011-05-05T00:00:00,2012-10-16T00:00:00,bill,Health,4064,4063
ny,2011-2012,lower,A 3564,Mandates the installation of warning labels on ultraviolet radiation devices,2011-05-05T00:00:00,2012-10-16T00:00:00,bill,Health,4080,4079
ny,2011-2012,lower,A 3573,Eliminates prior authorization under the preferred drug program for medications indicated by the Food and Drug Administration for the treatment of asthma,2011-05-05T00:00:00,2012-10-16T00:00:00,bill,Health,4090,4089
ny,2011-2012,lower,A 4028,"Relates to sex offenses facilitated by the use of controlled substances and ""date rape drugs""",2011-05-05T00:00:00,2012-10-16T00:00:00,bill,Health,4706,4705
ny,2011-2012,lower,A 3637,Relates to medical home multipayor programs,2011-05-05T00:00:00,2012-10-16T00:00:00,bill,Health,4166,4165
ny,2011-2012,lower,A 364,Prohibits the sale of information listed on prescriptions that identifies specific patients or persons legally authorized to issue a prescription,2011-05-05T00:00:00,2012-10-16T00:00:00,bill,Health,4172,4171
ny,2011-2012,lower,A 4075,Establishes a right to treatment for seriously emotionally disturbed children who are certified and waiting to be placed in a residential placement facility,2011-05-05T00:00:00,2012-10-16T00:00:00,bill,Health|Legal Issues,4761,4760
ny,2011-2012,lower,A 3683,Provides for the exclusion of certain costs associated with home health care and the formula for calculating state reimbursements to such programs,2011-05-05T00:00:00,2012-10-16T00:00:00,bill,Health,4225,4224
ny,2011-2012,lower,A 411A,Establishes the task force on adults with autism within the office of mental retardation and developmental disabilities,2011-05-16T00:00:00,2012-05-20T00:00:00,bill,Health|Legal Issues,4818,4817
ny,2011-2012,lower,A 412,Establishes program for familial dysautonomia and Tay-Sachs disease screening; authorizes department of health to provide grants,2011-05-05T00:00:00,2012-10-16T00:00:00,bill,Health,4820,4819
ny,2011-2012,lower,A 413A,Develops comprehensive care centers for autism spectrum disorders,2012-01-10T00:00:00,2012-05-20T00:00:00,bill,Health,4842,4841
ny,2011-2012,lower,A 4150A,Provides that residential health care facilities may return and redistribute unused medication,2012-05-17T00:00:00,2012-05-17T00:00:00,bill,Health,4858,4857
ny,2011-2012,lower,A 3752,Makes it unlawful for a person under the age of 18 to possess tobacco products,2011-05-05T00:00:00,2012-10-16T00:00:00,bill,Health,4314,4313
ny,2011-2012,lower,A 4159,Relates to the Westchester Medical Center's assignation to a certain peer group,2011-05-05T00:00:00,2012-10-16T00:00:00,bill,Health,4867,4866
ny,2011-2012,lower,A 376,"Makes provisions regarding safety of certain employees of the office of mental health, including certain staffing ratios and filling of staff vacancies",2011-05-05T00:00:00,2012-10-16T00:00:00,bill,Health|Legal Issues,4322,4321
ny,2011-2012,lower,A 3793,Relates to establishing the New York state telehealth/telemedicine act,2011-05-05T00:00:00,2012-10-16T00:00:00,bill,Health,4364,4363
ny,2011-2012,lower,A 4208,Directs department of health to contract with community organizations for distribution of information on health care services and benefits available to immigrants,2011-05-05T00:00:00,2012-10-16T00:00:00,bill,Health,4933,4932
ny,2011-2012,lower,A 3806A,Relates to providing pharmacies access to New York's prescription drug monitoring program resources,2011-05-05T00:00:00,2012-03-06T00:00:00,bill,Health,4388,4387
ny,2011-2012,lower,A 3807,Establishes a prescription monitoring program,2011-05-05T00:00:00,2012-10-16T00:00:00,bill,Health,4390,4389
ny,2011-2012,lower,A 4224,Requires food service establishments to post notice relating to the use of peanut oil,2011-05-05T00:00:00,2012-10-16T00:00:00,bill,Health,4951,4950
ny,2011-2012,lower,A 4272,Establishes a state diabetes coordinator within the department of health,2011-05-05T00:00:00,2012-10-16T00:00:00,bill,Health,5013,5012
ny,2011-2012,lower,A 4294,"Relates to bone marrow and peripheral blood stem cell donation and donation registration, and creates the anatomical gift, bone marrow and peripheral blood stem cell donation registry",2011-05-05T00:00:00,2012-10-16T00:00:00,bill,Health,5039,5038
ny,2011-2012,lower,A 431,Provides for hazardous materials emergency response training for emergency medical services personnel of a fire department of N.Y. city,2011-05-05T00:00:00,2012-10-16T00:00:00,bill,Health,5063,5062
ny,2011-2012,lower,A 5059,Enacts the safe cosmetics act of 2011,2011-05-05T00:00:00,2012-10-16T00:00:00,bill,Health,6005,6004
ny,2011-2012,lower,A 4824,"Enacts the ""New York state health kids act""",2011-05-05T00:00:00,2012-10-16T00:00:00,bill,Health,5705,5704
ny,2011-2012,lower,A 4824A,"Enacts the ""New York state health kids act""",2011-05-05T00:00:00,2012-04-26T00:00:00,bill,Health,5706,5705
ny,2011-2012,lower,A 5073,Relates to the health care practitioner volunteer program,2011-05-05T00:00:00,2012-10-16T00:00:00,bill,Health,6021,6020
ny,2011-2012,lower,A 4877,Repeals provisions relating to rates of payment of residential health care facilities and the withdrawal of equity and the transfer of assets,2011-05-05T00:00:00,2012-10-16T00:00:00,bill,Health,5774,5773
ny,2011-2012,lower,A 5108,Prohibits the dissemination of certain personal information,2011-05-05T00:00:00,2012-10-16T00:00:00,bill,Health|Legal Issues,6075,6074
ny,2011-2012,lower,A 4884,Authorizes certain health care professionals licensed to practice in other jurisdictions to practice in this state in connection with specified events,2011-05-05T00:00:00,2012-10-16T00:00:00,bill,Health,5784,5783
ny,2011-2012,lower,A 4884B,Authorizes certain health care professionals licensed to practice in other jurisdictions to practice in this state in connection with specified events,2011-05-24T00:00:00,2012-05-17T00:00:00,bill,Health,5786,5785
ny,2011-2012,lower,A 4891,Amends the inpatient reimbursement rates for certain general hospitals,2011-05-05T00:00:00,2012-10-16T00:00:00,bill,Health,5795,5794
ny,2011-2012,lower,A 4898,Relates to insurance reimbursement for early intervention services for infants and toddlers with disabilities,2011-05-05T00:00:00,2012-10-16T00:00:00,bill,Health,5803,5802
ny,2011-2012,lower,A 4908,"Requires all hospitals to establish, utilize and complete a checklist for each intensive care medical procedure performed in the hospital",2011-05-05T00:00:00,2012-10-16T00:00:00,bill,Health,5818,5817
ny,2011-2012,lower,A 5144,Requires volunteers of youth sports organizations to be screened through use of the statewide sex offender registry,2011-05-05T00:00:00,2012-10-16T00:00:00,bill,Health,6121,6120
ny,2011-2012,lower,A 4921,Provides guidelines and aids in locating sites for community residential facilities,2011-05-05T00:00:00,2012-10-16T00:00:00,bill,Health|Legal Issues,5834,5833
ny,2011-2012,lower,A 4943,Relates to food allergy awareness in food establishments,2011-05-05T00:00:00,2012-10-16T00:00:00,bill,Health,5860,5859
ny,2011-2012,lower,A 4969,Prohibits a health care coverage plan from making a payment or reimbursement for treatment related to the care of a patient with a hospital acquired infection,2011-05-05T00:00:00,2012-10-16T00:00:00,bill,Health,5890,5889
ny,2011-2012,lower,A 4970,Requires hospitals to permit selective pre-surgery blood donation,2011-05-05T00:00:00,2012-10-16T00:00:00,bill,Health,5892,5891
ny,2011-2012,lower,A 5008,Adds four new compounds to the controlled substance schedule of hallucinogenic substances,2011-05-05T00:00:00,2012-10-16T00:00:00,bill,Health,5940,5939
ny,2011-2012,lower,A 5242,Excludes fundraising from consideration in appropriating state aid and reimbursement for services to volunteer ambulance companies,2011-05-05T00:00:00,2012-10-16T00:00:00,bill,Health,6248,6247
ny,2011-2012,lower,A 5036,Allows vesting of a health care proxy authority without incapacity of ward,2011-05-05T00:00:00,2012-10-16T00:00:00,bill,Health,5974,5973
ny,2011-2012,upper,S 1024,Provides for a program of asthma disease management and control within the department of health,2011-05-05T00:00:00,2012-10-16T00:00:00,bill,Health,19920,19919
ny,2011-2012,upper,S 1035,Directs the commissioner of health to establish and implement a uniform letter grading system to classify health inspection results,2011-05-05T00:00:00,2012-10-16T00:00:00,bill,Health,19938,19937
ny,2011-2012,upper,S 1123,Provides for the review of the criminal history information of prospective residents of nursing homes,2011-05-05T00:00:00,2012-10-16T00:00:00,bill,Health,20054,20053
ny,2011-2012,upper,S 1132,Requires hospitals to provide language assistance services,2011-05-05T00:00:00,2012-10-16T00:00:00,bill,Health,20065,20064
ny,2011-2012,upper,S 1158,Directs department of health to contract with community organizations for distribution of information on health care services and benefits available to immigrants,2011-05-05T00:00:00,2012-10-16T00:00:00,bill,Health,20094,20093
ny,2011-2012,upper,S 1166,Establishes a task force to assess the public health impact of firearm violence and provides for the repeal thereof,2011-05-05T00:00:00,2012-10-16T00:00:00,bill,Health,20104,20103
ny,2011-2012,upper,S 117,Relates to increasing the availability of adult day health care programs in certain counties,2011-05-05T00:00:00,2012-10-16T00:00:00,bill,Health,20110,20109
ny,2011-2012,upper,S 1173,Requires the department of health to study the effects of certain training criteria established by the Lymphology Association of North America,2011-05-05T00:00:00,2012-10-16T00:00:00,bill,Health,20114,20113
ny,2011-2012,upper,S 1175,"Provides for taxpayer gifts for lupus education and prevention, and establishes the lupus education and prevention fund and outreach program",2011-05-05T00:00:00,2012-10-16T00:00:00,bill,Health,20116,20115
ny,2011-2012,upper,S 117A,Relates to increasing the availability of adult day health care programs in certain counties,2012-01-07T00:00:00,2012-01-07T00:00:00,bill,Health,20121,20120
ny,2011-2012,upper,S 1201A,Exempts non-resident students at community colleges from certain immunization requirements,2011-05-05T00:00:00,2012-02-11T00:00:00,bill,Health,20154,20153
ny,2011-2012,upper,S 1207,Prohibits disclosure of testimony of a party to a health care quality assurance or peer review proceeding,2011-05-05T00:00:00,2012-10-16T00:00:00,bill,Health,20161,20160
ny,2011-2012,upper,S 125,Relates to the use of environmentally-sensitive cleaning and maintenance products in nursing homes and adult homes,2011-05-05T00:00:00,2012-10-16T00:00:00,bill,Health,20219,20218
ny,2011-2012,upper,S 125A,Relates to the use of environmentally-sensitive cleaning and maintenance products in nursing homes and adult homes,2012-01-07T00:00:00,2012-01-07T00:00:00,bill,Health,20232,20231
ny,2011-2012,upper,S 1277,"Authorizes a certified psychologist or a certified nurse practitioner, in addition to other authorized individuals, to make a recommendation of the type of residence",2011-05-05T00:00:00,2012-10-16T00:00:00,bill,Health|Legal Issues,20255,20254
ny,2011-2012,upper,S 1331,"Enacts the ""philosophical exemption to immunizations act""",2011-05-05T00:00:00,2012-10-16T00:00:00,bill,Health,20325,20324
ny,2011-2012,upper,S 1336,Requires restaurants with a seating capacity of 10 or more to provide public toilet facilities,2011-05-05T00:00:00,2012-10-16T00:00:00,bill,Health,20331,20330
ny,2011-2012,upper,S 1359,Directs the commissioner of health to report on the very high incidence of asthma in the state,2011-05-05T00:00:00,2012-10-16T00:00:00,bill,Health,20362,20361
ny,2011-2012,upper,S 1408,Authorizes the immunization against hepatitis B of minors capable of consent who are housed in a local or state correctional facility,2011-05-05T00:00:00,2012-10-16T00:00:00,bill,Health,20425,20424
ny,2011-2012,upper,S 1438,Enacts bill of adoptee rights clarifying language and procedures for obtaining birth certificates and medical histories for adoptees,2011-05-05T00:00:00,2012-10-16T00:00:00,bill,Health,20469,20468
ny,2011-2012,upper,S 1457,Relates to personal watercraft and certain safety provisions that require their use,2011-05-05T00:00:00,2012-10-16T00:00:00,bill,Health,20497,20496
ny,2011-2012,upper,S 1457A,Relates to personal watercraft and certain safety provisions that require their use,2011-06-12T00:00:00,2012-02-04T00:00:00,bill,Health,20498,20497
ny,2011-2012,upper,S 1458,"Authorizes agreements for county, city and town social services departments to access death certificates maintained by the department of public health",2011-05-05T00:00:00,2012-10-16T00:00:00,bill,Health,20499,20498
ny,2011-2012,upper,S 1476,Authorizes the state to acquire from the federal government the Montrose VA,2011-05-05T00:00:00,2012-10-16T00:00:00,bill,Health,20524,20523
ny,2011-2012,upper,S 1572,"Establishes an age-appropriate sex education grant program, to be referred to as the healthy teens act",2011-05-05T00:00:00,2012-10-16T00:00:00,bill,Health,20646,20645
ny,2011-2012,upper,S 1572A,"Establishes an age-appropriate sex education grant program, to be referred to as the healthy teens act",2012-01-07T00:00:00,2012-02-10T00:00:00,bill,Health,20647,20646
ny,2011-2012,upper,S 1625,Regulates the establishment and location of methadone treatment centers,2011-05-05T00:00:00,2012-10-16T00:00:00,bill,Health|Legal Issues,20725,20724
ny,2011-2012,upper,S 1625A,Regulates the establishment and location of methadone treatment centers,2011-05-18T00:00:00,2012-02-15T00:00:00,bill,Health|Legal Issues,20726,20725
ny,2011-2012,upper,S 1626,Prohibits missed appointment charges where physician's office receives notice of cancellation of appointment at least one hour before time; requires disclosure,2011-05-05T00:00:00,2012-10-16T00:00:00,bill,Health,20727,20726
ny,2011-2012,upper,S 1637,Authorizes and directs an evaluation of the need for educating barbers on the health and safety aspects of their trade,2011-05-05T00:00:00,2012-10-16T00:00:00,bill,Health,20740,20739
ny,2011-2012,upper,S 1644,Requires a warning label attached to any holiday decorations containing lead,2011-05-05T00:00:00,2012-10-16T00:00:00,bill,Health,20750,20749
ny,2011-2012,upper,S 1689,Authorizes health care professionals licensed in other jurisdictions and appointed by World Triathlon Corporation to practice in this state at a triathlon,2011-05-05T00:00:00,2012-10-16T00:00:00,bill,Health,20811,20810
ny,2011-2012,upper,S 1696,Relates to approval of demonstration projects for the operation of proton beam therapy services,2011-05-05T00:00:00,2012-10-16T00:00:00,bill,Health,20819,20818
ny,2011-2012,upper,S 1748,Provides that residential health care facilities may return and redistribute unused medication,2011-05-05T00:00:00,2012-10-16T00:00:00,bill,Health,20885,20884
ny,2011-2012,upper,S 1748A,Provides that residential health care facilities may return and redistribute unused medication,2011-06-17T00:00:00,2012-02-14T00:00:00,bill,Health,20886,20885
ny,2011-2012,upper,S 1764,Establishes the save our sight program and the save our sight fund to provide vision screening and educational information,2011-05-05T00:00:00,2012-10-16T00:00:00,bill,Health,20906,20905
ny,2011-2012,upper,S 1764A,Establishes the save our sight program and the save our sight fund to provide vision screening and educational information,2012-01-07T00:00:00,2012-02-03T00:00:00,bill,Health,20907,20906
ny,2011-2012,upper,S 182,Requires hospitals to notify patients of a non-participating physician or health care provider providing treatment at a participating hospital,2011-05-05T00:00:00,2012-10-16T00:00:00,bill,Health,20983,20982
ny,2011-2012,upper,S 1850,Requires general hospitals to establish policies/procedures regarding domestic violence; to establish training programs; to designate staff to coordinate services,2011-05-05T00:00:00,2012-10-16T00:00:00,bill,Health,21024,21023
ny,2011-2012,upper,S 188,Relates to the disclosure of special care offered to persons with Alzheimer's disease or dementia,2011-05-05T00:00:00,2012-10-16T00:00:00,bill,Health,21064,21063
ny,2011-2012,upper,S 1888,Requires reporting of toy-related injuries,2011-05-05T00:00:00,2012-10-16T00:00:00,bill,Health,21078,21077
ny,2011-2012,upper,S 1923,Establishes the advisory committee on public wellness to assist health insurers and employers in establishing wellness programs for insureds and employees,2011-05-05T00:00:00,2012-10-16T00:00:00,bill,Health,21118,21117
ny,2011-2012,upper,S 196,"Makes provisions regarding safety of certain employees of the office of mental health, including certain staffing ratios and filling of staff vacancies",2011-05-05T00:00:00,2012-10-16T00:00:00,bill,Health|Legal Issues,21158,21157
ny,2011-2012,upper,S 2024,Directs that all ambulances' shall be equipped with epinephrine auto-injector devices,2011-05-05T00:00:00,2012-10-16T00:00:00,bill,Health,21245,21244
