state,session,chamber,bill_id,title,created_at,updated_at,type,subjects,serialid,serial_464208c8_41a1_4999_a4ad_858be4add44b
ny,2011-2012,lower,A 7384,Requires the guardian of a deceased incapacitated person to notify the local department of social services within 20 days of such death,2011-05-05T00:00:00,2012-10-16T00:00:00,bill,Health|Legal Issues,9169,9168
ny,2011-2012,lower,A 7408,Provides for the evaluation of a nuclear power plant prior to the issuance of a license to extend the period of operation of such plant,2011-05-05T00:00:00,2012-10-16T00:00:00,bill,Health,9206,9205
ny,2011-2012,lower,A 7431,"Requires accredited office-based surgery facilities to register with its accrediting agency, in consultation with the department of health",2011-05-05T00:00:00,2012-10-16T00:00:00,bill,Health,9242,9241
ny,2011-2012,lower,A 7431A,"Requires accredited office-based surgery facilities to register with its accrediting agency, in consultation with the department of health",2011-06-30T00:00:00,2012-02-16T00:00:00,bill,Health,9243,9242
ny,2011-2012,lower,A 7431B,"Requires accredited office-based surgery facilities to register with its accrediting agency, in consultation with the department of health",2012-01-19T00:00:00,2012-02-16T00:00:00,bill,Health,9244,9243
ny,2011-2012,lower,A 7439,Relates to content of pre-admission reports for persons entering assisted living residences,2011-05-05T00:00:00,2012-10-16T00:00:00,bill,Health,9254,9253
ny,2011-2012,lower,A 7439A,Relates to content of pre-admission reports for persons entering assisted living residences,2011-06-02T00:00:00,2012-04-17T00:00:00,bill,Health,9255,9254
ny,2011-2012,lower,A 7462,Requires that any father of an out-of-wedlock child be listed on such child's birth certificate,2011-05-05T00:00:00,2012-10-16T00:00:00,bill,Health,9290,9289
ny,2011-2012,lower,A 7485,"Restricts the definition of ""student"" for purposes of immunization of post-secondary students",2011-05-16T00:00:00,2012-10-16T00:00:00,bill,Health,9323,9322
ny,2011-2012,lower,A 7489,"Requires health plans with coverage of out of plan medical services to provide certain information to insureds, subscribers and enrollees",2011-05-16T00:00:00,2012-10-16T00:00:00,bill,Health,9328,9327
ny,2011-2012,lower,A 7489A,Prohibits approval of a health maintenance plan that does not include coverage of out of plan medical services,2011-06-14T00:00:00,2012-02-16T00:00:00,bill,Health,9329,9328
ny,2011-2012,lower,A 7489B,"Requires health plans with coverage of out of plan medical services to provide certain information to insureds, subscribers and enrollees",2012-01-07T00:00:00,2012-02-16T00:00:00,bill,Health,9330,9329
ny,2011-2012,lower,A 7495,Requires the state to pay the costs of prosecution of an inmate-patient of a state psychiatric facility,2011-05-16T00:00:00,2012-10-16T00:00:00,bill,Health|Legal Issues,9342,9341
ny,2011-2012,lower,A 7517,Extends the provisions of chapter 459 of the laws of 1996 amending the public health law relating to recertification of persons providing emergency medical care,2011-05-16T00:00:00,2012-10-16T00:00:00,bill,Health,9372,9371
ny,2011-2012,lower,A 7534,Establishes a state-wide database on the location and availability of medical procedures,2011-05-16T00:00:00,2012-10-16T00:00:00,bill,Health,9392,9391
ny,2011-2012,lower,A 7539,Relates to the New York state tobacco settlement cancer research and treatment program,2011-05-16T00:00:00,2012-10-16T00:00:00,bill,Health,9397,9396
ny,2011-2012,lower,A 754,Allows attending physicians to admit persons arriving at the hospital for emergency treatment when such attending physician deems this necessary for care,2011-05-05T00:00:00,2012-10-16T00:00:00,bill,Health,9398,9397
ny,2011-2012,lower,A 7540,Establishes additional notice requirements for site selection for community residential facilities,2011-05-16T00:00:00,2012-10-16T00:00:00,bill,Health|Legal Issues,9399,9398
ny,2011-2012,lower,A 7573,Relates to the review and approval process for a license to operate an assisted living residence,2011-05-16T00:00:00,2012-10-16T00:00:00,bill,Health,9446,9445
ny,2011-2012,lower,A 7585,Requires general hospitals to establish policies/procedures regarding domestic violence; to establish training programs; to designate staff to coordinate services,2011-05-16T00:00:00,2012-10-16T00:00:00,bill,Health,9464,9463
ny,2011-2012,lower,A 7585A,Requires general hospitals to establish policies/procedures regarding domestic violence; to establish training programs; to designate staff to coordinate services,2012-02-01T00:00:00,2012-05-17T00:00:00,bill,Health,9465,9464
ny,2011-2012,lower,A 7587,Authorizes the sale of cigarettes to individuals twenty-one years of age or older,2011-05-16T00:00:00,2012-10-16T00:00:00,bill,Health,9467,9466
ny,2011-2012,lower,A 7588,Prohibits the advertisement of tobacco products and herbal cigarettes near schools,2011-05-16T00:00:00,2012-10-16T00:00:00,bill,Health,9468,9467
ny,2011-2012,lower,A 7594,Prohibits certain persons from controlling the disposition of a decedent's remains,2011-05-16T00:00:00,2012-10-16T00:00:00,bill,Health,9477,9476
ny,2011-2012,lower,A 7610,Establishes a cause of action for damages against a person who attempts or performs a sex selective abortion,2011-05-16T00:00:00,2012-10-16T00:00:00,bill,Health,9504,9503
ny,2011-2012,lower,A 7626,Requires drug tests for potential employees of the office of mental health and the office for people with developmental disabilities,2011-05-16T00:00:00,2012-10-16T00:00:00,bill,Health|Legal Issues,9523,9522
ny,2011-2012,lower,A 7634,Prohibits the substitution of opioid analgesic drugs for an opioid analgesic drug incorporating tamper resistance technology,2011-05-16T00:00:00,2012-10-16T00:00:00,bill,Health,9534,9533
ny,2011-2012,lower,A 7649,Provides legal assistance to youth ordered by the court into the custody of the office of children and family services and placed or committed to a state operated juvenile detention center,2011-05-16T00:00:00,2012-10-16T00:00:00,bill,Health|Legal Issues,9556,9555
ny,2011-2012,lower,A 7650,Relates to permitting a hospice to employ and enter into contracts with licensed healthcare professionals,2011-05-16T00:00:00,2012-10-16T00:00:00,bill,Health,9558,9557
ny,2011-2012,lower,A 7650A,Relates to permitting a hospice to employ and enter into contracts with licensed healthcare professionals,2011-06-02T00:00:00,2012-04-20T00:00:00,bill,Health,9559,9558
ny,2011-2012,lower,A 7662,Sets nutrition standards for restaurants distributing incentive items aimed at children,2011-05-16T00:00:00,2012-10-16T00:00:00,bill,Health,9575,9574
ny,2011-2012,lower,A 7662A,Sets nutrition standards for restaurants distributing incentive items aimed at children,2012-03-20T00:00:00,2012-03-20T00:00:00,bill,Health,9576,9575
ny,2011-2012,lower,A 7665,Eliminates requirement for prior approval of certain hospital repair and maintenance construction projects,2011-05-16T00:00:00,2012-10-16T00:00:00,bill,Health,9579,9578
ny,2011-2012,lower,A 7665A,Eliminates requirement for prior approval of certain hospital repair and maintenance construction projects,2011-06-10T00:00:00,2012-03-20T00:00:00,bill,Health,9580,9579
ny,2011-2012,lower,A 7665B,Eliminates requirement for prior approval of certain hospital repair and maintenance construction projects,2011-06-15T00:00:00,2012-03-20T00:00:00,bill,Health,9581,9580
ny,2011-2012,lower,A 7667,Authorizes certain campgrounds without dumping stations to provide a list of dumping stations,2011-05-16T00:00:00,2012-10-16T00:00:00,bill,Health,9583,9582
ny,2011-2012,lower,A 7667A,Authorizes certain campgrounds without dumping stations to provide a list of dumping stations,2011-05-25T00:00:00,2012-02-29T00:00:00,bill,Health,9584,9583
ny,2011-2012,lower,A 7678,Eliminates the alternative of strict and intensive supervision and treatment for sex offenders requiring civil management; repealer,2011-05-16T00:00:00,2012-10-16T00:00:00,bill,Health|Legal Issues,9600,9599
ny,2011-2012,lower,A 7699,Relates to providing quality out-patient specialty care for certain patients regardless of source of payment or insurance type,2011-05-16T00:00:00,2012-10-16T00:00:00,bill,Health,9626,9625
ny,2011-2012,lower,A 7699A,Relates to providing quality out-patient specialty care for certain patients regardless of source of payment or insurance type,2011-05-21T00:00:00,2012-05-05T00:00:00,bill,Health,9627,9626
ny,2011-2012,lower,A 7733,Increases the availability of adult day health care programs by authorizing adult care facilities to operate such programs,2011-05-16T00:00:00,2012-10-16T00:00:00,bill,Health,9674,9673
ny,2011-2012,lower,A 7749,Authorizes certain health care professionals licensed to practice in other jurisdictions to practice in this state in connection with an event sanctioned by Remote Area Medical,2011-05-16T00:00:00,2012-10-16T00:00:00,bill,Health,9694,9693
ny,2011-2012,lower,A 7772,Provides for an extender of 2 years for the safe patient handling demonstration program,2011-05-17T00:00:00,2012-10-16T00:00:00,bill,Health,9728,9727
ny,2011-2012,lower,A 7776,Relates to prohibiting certain restaurants and food establishments from serving foods containing artificial trans fat,2011-05-17T00:00:00,2012-10-16T00:00:00,bill,Health,9733,9732
ny,2011-2012,lower,A 7776A,Relates to prohibiting certain restaurants and food establishments from serving foods containing artificial trans fat,2012-03-13T00:00:00,2012-05-09T00:00:00,bill,Health,9734,9733
ny,2011-2012,lower,A 7788,Requires the commissioner of health to create a list of long-term care contact information for the NY Connects: Choices for Long Term Care program,2011-05-18T00:00:00,2012-10-16T00:00:00,bill,Health,9753,9752
ny,2011-2012,lower,A 7788A,Requires the commissioner of health to create a list of long-term care contact information for the NY Connects: Choices for Long Term Care program,2011-06-12T00:00:00,2012-04-28T00:00:00,bill,Health,9754,9753
ny,2011-2012,lower,A 7788B,Requires the commissioner of health to create a list of long-term care contact information for the NY Connects: Choices for Long Term Care program,2012-03-03T00:00:00,2012-04-28T00:00:00,bill,Health,9755,9754
ny,2011-2012,lower,A 7799,Relates to policies and procedures involving anatomical gifts; repealer,2011-05-18T00:00:00,2012-10-16T00:00:00,bill,Health,9777,9776
ny,2011-2012,lower,A 7804,Requires the office of alcoholism and substance abuse services to develop training materials for screening for alcoholism and chemical dependency,2011-05-18T00:00:00,2012-10-16T00:00:00,bill,Health|Legal Issues,9786,9785
ny,2011-2012,lower,A 7805,Requires the office of alcoholism and substance abuse services to develop a prescription drug abuse public awareness campaign,2011-05-18T00:00:00,2012-10-16T00:00:00,bill,Health,9787,9786
ny,2011-2012,lower,A 7806,Defines the scope of responsibilities of the office of alcoholism and substance abuse services regarding recovery services for veterans,2011-05-18T00:00:00,2012-10-16T00:00:00,bill,Health|Legal Issues,9788,9787
ny,2011-2012,lower,A 7807,Requires the office of alcoholism and substance abuse services to develop educational materials relating to screening for prescription drug abuse,2011-05-18T00:00:00,2012-10-16T00:00:00,bill,Health|Legal Issues,9789,9788
ny,2011-2012,lower,A 7810,Allows limited liability companies to operate renal disease diagnostic or treatment centers,2011-05-18T00:00:00,2012-10-16T00:00:00,bill,Health,9793,9792
ny,2011-2012,lower,A 7841,Restricts state funds from being allocated to Planned Parenthood or any organization which preforms abortions,2011-05-20T00:00:00,2012-10-16T00:00:00,bill,Health,9847,9846
ny,2011-2012,lower,A 7845,Establishes the health care practitioner hygienic dress code program within the department of health to address clothing and jewelry that may cause infections,2011-05-20T00:00:00,2012-10-16T00:00:00,bill,Health,9851,9850
ny,2011-2012,lower,A 7845A,Establishes the health care practitioner hygienic dress code program within the department of health to address clothing and jewelry that may cause infections,2012-02-09T00:00:00,2012-02-17T00:00:00,bill,Health,9852,9851
ny,2011-2012,lower,A 7858,Provides that the department of health may share certain information about environmentally-related diseases,2011-05-20T00:00:00,2012-10-16T00:00:00,bill,Health,9869,9868
ny,2011-2012,lower,A 7860,Provides for establishment of the New York Health plan and makes an appropriation to the temporary commission on implementation of the plan,2011-05-20T00:00:00,2012-10-16T00:00:00,bill,Health,9873,9872
ny,2011-2012,lower,A 7866,Creates the well water and water supply education act; requires public education program on the potential hazards of private water supplies,2011-05-20T00:00:00,2012-10-16T00:00:00,bill,Health,9880,9879
ny,2011-2012,lower,A 7866A,Creates the well water and water supply education act; requires public education program on the potential hazards of private water supplies,2011-06-09T00:00:00,2012-04-18T00:00:00,bill,Health,9881,9880
ny,2011-2012,lower,A 7866B,Creates the well water and water supply education act; requires public education program on the potential hazards of private water supplies,2012-01-28T00:00:00,2012-04-18T00:00:00,bill,Health,9882,9881
ny,2011-2012,lower,A 7892,Authorizes the commissioner of health to award grants without competitive bid under the health care efficiency and affordability program to home care services,2011-05-21T00:00:00,2012-10-16T00:00:00,bill,Health,9920,9919
ny,2011-2012,lower,A 7893,Expands the health occupation and workplace demonstration program to home health care providers,2011-05-21T00:00:00,2012-10-16T00:00:00,bill,Health,9921,9920
ny,2011-2012,lower,A 7895,Creates a rural home health flexibility program,2011-05-21T00:00:00,2012-10-16T00:00:00,bill,Health,9923,9922
ny,2011-2012,lower,A 7896,"Provides for taxpayer gifts for lupus education and prevention, and establishes the lupus education and prevention fund and outreach program",2011-05-21T00:00:00,2012-10-16T00:00:00,bill,Health,9924,9923
ny,2011-2012,lower,A 7896A,"Provides for taxpayer gifts for lupus education and prevention, and establishes the lupus education and prevention fund and outreach program",2012-02-07T00:00:00,2012-02-17T00:00:00,bill,Health,9925,9924
ny,2011-2012,lower,A 7917,"Relates to the sale, delivery, dispensing and distribution of controlled substances; repealer",2011-05-25T00:00:00,2012-10-16T00:00:00,bill,Health,9956,9955
ny,2011-2012,lower,A 7917A,"Relates to the sale, delivery, dispensing and distribution of controlled substances; repealer",2011-06-19T00:00:00,2012-05-11T00:00:00,bill,Health,9957,9956
ny,2011-2012,lower,A 7922,Requires the state to reimburse municipalities for loss of real property tax revenue resulting from establishment of community residential facilities,2011-05-25T00:00:00,2012-10-16T00:00:00,bill,Health|Legal Issues,9964,9963
ny,2011-2012,lower,A 7927,"Directs the commissioner of health to provide each nursing home, regulated by the state, with an external defibrillator",2011-05-25T00:00:00,2012-10-16T00:00:00,bill,Health,9969,9968
ny,2011-2012,lower,A 7936,Authorizes health care professionals licensed in other jurisdictions and appointed by World Police and Fire Games Federation to practice in N.Y. in connection with an athletic event sanctioned by such federation,2011-05-26T00:00:00,2012-10-16T00:00:00,bill,Health,9981,9980
ny,2011-2012,lower,A 7936A,Authorizes health care professionals licensed in other jurisdictions and appointed by World Police and Fire Games Federation to practice in N.Y. in connection with an athletic event sanctioned by such federation,2011-06-02T00:00:00,2012-05-03T00:00:00,bill,Health,9982,9981
ny,2011-2012,lower,A 7936B,Authorizes health care professionals licensed in other jurisdictions and appointed by World Police and Fire Games Federation to practice in N.Y. in connection with an athletic event sanctioned by such federation,2011-06-10T00:00:00,2012-05-03T00:00:00,bill,Health,9983,9982
ny,2011-2012,lower,A 7941,Requires facilities to perform pulse oximetry screening on newborns,2011-05-26T00:00:00,2012-10-16T00:00:00,bill,Health,9989,9988
ny,2011-2012,lower,A 804,Relates to the qualifications of operators of health facilities,2011-05-05T00:00:00,2012-10-16T00:00:00,bill,Health,10124,10123
ny,2011-2012,lower,A 805,Establishes the prescription drug discount program; repealer,2011-05-05T00:00:00,2012-10-16T00:00:00,bill,Health,10138,10137
ny,2011-2012,lower,A 806,Relates to requirements for the safe handling of prescription drug samples by certain health care professionals,2011-05-05T00:00:00,2012-10-16T00:00:00,bill,Health,10149,10148
ny,2011-2012,lower,A 807,Establishes the clinical trial access and education fund to provide grants for certain services for patients with life-threatening or disabling conditions/diseases,2011-05-05T00:00:00,2012-10-16T00:00:00,bill,Health,10162,10161
ny,2011-2012,lower,A 808,"Establishes an age-appropriate sex education grant program, to be referred to as the healthy teens act",2011-05-05T00:00:00,2012-10-16T00:00:00,bill,Health,10173,10172
ny,2011-2012,lower,A 8085,Authorizes the commissioner of health to extend use of audit findings to subsequent un-audited periods for payments to patient service providers,2011-06-02T00:00:00,2012-10-16T00:00:00,bill,Health,10179,10178
ny,2011-2012,lower,A 809,Provides for pharmacy benefit management and the procurement of prescription drugs at a negotiated rate for dispensation,2011-05-05T00:00:00,2012-10-16T00:00:00,bill,Health,10185,10184
ny,2011-2012,lower,A 8098,"Extends from December 31, 2011 to December 31, 2013, the expiration of the authorization of operating demonstrations to operate managed long term care plans",2011-06-02T00:00:00,2012-10-16T00:00:00,bill,Health,10195,10194
ny,2011-2012,lower,A 81,Relates to the establishment of convenient care clinics,2011-05-05T00:00:00,2012-10-16T00:00:00,bill,Health,10197,10196
ny,2011-2012,lower,A 810,Includes health care facilities operated or supervised by the department of correctional services or local correctional facilities within the definition of hospital,2011-05-05T00:00:00,2012-10-16T00:00:00,bill,Health,10198,10197
ny,2011-2012,lower,A 8107,"Requires health care professional undergraduate, graduate and continuing education in chronic pain management and treatment",2011-06-02T00:00:00,2012-10-16T00:00:00,bill,Health,10207,10206
ny,2011-2012,lower,A 812,Provides for funding of early intervention services,2011-05-05T00:00:00,2012-10-16T00:00:00,bill,Health,10227,10226
ny,2011-2012,lower,A 8127,Relates to limiting the work week of direct care workers,2011-06-03T00:00:00,2012-10-16T00:00:00,bill,Health|Legal Issues,10237,10236
ny,2011-2012,lower,A 8127A,Relates to limiting the work week of direct care workers,2011-06-17T00:00:00,2012-02-17T00:00:00,bill,Health|Legal Issues,10238,10237
ny,2011-2012,lower,A 8128,Requires the department of health to post inspection results of public food service establishments on the website,2011-06-03T00:00:00,2012-10-16T00:00:00,bill,Health,10239,10238
ny,2011-2012,lower,A 8128A,Requires the department of health to post inspection results of public food service establishments on the website,2011-06-16T00:00:00,2012-02-17T00:00:00,bill,Health,10240,10239
ny,2011-2012,lower,A 8128B,Requires the department of health to post inspection results of public food service establishments on the website,2011-10-12T00:00:00,2012-02-17T00:00:00,bill,Health,10241,10240
ny,2011-2012,lower,A 8132,Provides alternative pricing methods in the sale and offering of funeral merchandise and services; provides for the repeal after one year,2011-06-03T00:00:00,2012-10-16T00:00:00,bill,Health,10246,10245
ny,2011-2012,lower,A 8134,"Authorizes the establishment of a long term care community in Columbia county known as Camphill Ghent, Inc. to provide integrated services to certain persons",2011-06-03T00:00:00,2012-10-16T00:00:00,bill,Health,10248,10247
ny,2011-2012,lower,A 8134A,"Authorizes the establishment of a long term care community in Columbia county known as Camphill Ghent, Inc. to provide integrated services to certain persons",2011-06-09T00:00:00,2012-03-02T00:00:00,bill,Health,10249,10248
ny,2011-2012,lower,A 8176,Requires clinical education in pain management and palliative care,2011-06-04T00:00:00,2012-10-16T00:00:00,bill,Health,10313,10312
ny,2011-2012,lower,A 8178,Relates to establishing a certificate of still birth,2011-06-04T00:00:00,2012-10-16T00:00:00,bill,Health,10315,10314
ny,2011-2012,lower,A 8178A,Relates to establishing a certificate of still birth,2011-06-12T00:00:00,2012-02-17T00:00:00,bill,Health,10316,10315
ny,2011-2012,lower,A 8179,Relates to restricting duties which may be assigned to specialist's assistants in radiology,2011-06-04T00:00:00,2012-10-16T00:00:00,bill,Health,10317,10316
ny,2011-2012,lower,A 8190,Relates to licensing and registration for funeral directors,2011-06-07T00:00:00,2012-10-16T00:00:00,bill,Health,10334,10333
ny,2011-2012,lower,A 8194,Directs commissioners of education and health to adopt rules and regulations for the treatment and monitoring of students with mild traumatic brain injuries,2011-06-07T00:00:00,2012-10-16T00:00:00,bill,Health,10340,10339
ny,2011-2012,lower,A 81A,Relates to the establishment of convenient care clinics,2011-05-05T00:00:00,2012-05-10T00:00:00,bill,Health,10349,10348
ny,2011-2012,lower,A 81B,Relates to the establishment of convenient care clinics,2011-06-04T00:00:00,2012-05-10T00:00:00,bill,Health,10350,10349
ny,2011-2012,lower,A 82,Requires cigarette manufacturers to disclose chemical additives and product design characteristics in cigarettes,2011-05-05T00:00:00,2012-10-16T00:00:00,bill,Health,10351,10350
ny,2011-2012,lower,A 8202,Establishes the clinical information resource access program to provide information to medical institutions and facilities,2011-06-07T00:00:00,2012-10-16T00:00:00,bill,Health,10355,10354
ny,2011-2012,lower,A 8213,"Disqualifies providers for receipt of monies for recruitment and retention of non-supervisory workers, when such monies are not provided to home health agencies",2011-06-08T00:00:00,2012-10-16T00:00:00,bill,Health,10369,10368
ny,2011-2012,lower,A 8231,Directs schools to provide information on meningococcal disease immunization to students and parents of students in seventh grade,2011-06-08T00:00:00,2012-10-16T00:00:00,bill,Health,10391,10390
ny,2011-2012,lower,A 8248,"Provides for the payment of capitated rates for services provided by assisted living programs, whether freestanding or not",2011-06-09T00:00:00,2012-10-16T00:00:00,bill,Health,10415,10414
ny,2011-2012,lower,A 8283,"Extends the effectiveness of the toll plaza air quality task force through April 1, 2012",2011-06-12T00:00:00,2012-10-16T00:00:00,bill,Health,10461,10460
ny,2011-2012,lower,A 83,Provides restroom access to persons with certain medical conditions,2011-05-05T00:00:00,2012-10-16T00:00:00,bill,Health,10484,10483
ny,2011-2012,lower,A 8307,Relates to the adoption registry,2011-06-14T00:00:00,2012-10-16T00:00:00,bill,Health,10495,10494
ny,2011-2012,lower,A 8320,Enacts the Internet System for Tracking Over-Prescribing (I-STOP) Act,2011-06-14T00:00:00,2012-10-16T00:00:00,bill,Health,10515,10514
ny,2011-2012,lower,A 8322,Relates to designating the ombudsman as an employee of the commissioner on quality of care and advocacy for persons with disabilities,2011-06-14T00:00:00,2012-10-16T00:00:00,bill,Health|Legal Issues,10517,10516
ny,2011-2012,lower,A 8323,Requires standardized training curriculum for persons employed or volunteering at a mental health care provider certified or operated by the office for people with developmental disabilities,2011-06-14T00:00:00,2012-10-16T00:00:00,bill,Health|Legal Issues,10518,10517
ny,2011-2012,lower,A 8324,Relates to providing notice of abuse investigations at mental hygiene agencies,2011-06-14T00:00:00,2012-10-16T00:00:00,bill,Health|Legal Issues,10519,10518
ny,2011-2012,lower,A 8324A,Relates to providing notice of abuse investigations at mental hygiene agencies,2011-06-16T00:00:00,2011-06-24T00:00:00,bill,Health|Legal Issues,10520,10519
ny,2011-2012,lower,A 8325,Relates to reporting of crimes at mental hygiene facilities,2011-06-14T00:00:00,2012-10-16T00:00:00,bill,Health|Legal Issues,10521,10520
ny,2011-2012,lower,A 8330,Creates an abuse prevention notification system,2011-06-14T00:00:00,2012-10-16T00:00:00,bill,Health|Legal Issues,10528,10527
ny,2011-2012,lower,A 8336,Authorizes the commissioner of health to extend use of prior settlements to subsequent un-audited periods for payments to patient service providers,2011-06-15T00:00:00,2012-10-16T00:00:00,bill,Health,10534,10533
ny,2011-2012,lower,A 8357,Prohibits co-mingling of adolescent and adult patients in certain hospitals licensed by the office of mental health; repealer,2011-06-15T00:00:00,2012-10-16T00:00:00,bill,Health|Legal Issues,10560,10559
ny,2011-2012,lower,A 8364,Relates to disqualification of employment for criminal history and the definition of ability to consent,2011-06-15T00:00:00,2012-10-16T00:00:00,bill,Health|Legal Issues,10571,10570
ny,2011-2012,lower,A 8386,Establishes the nurse loan repayment program,2011-06-16T00:00:00,2012-10-16T00:00:00,bill,Health,10604,10603
ny,2011-2012,lower,A 8386A,Establishes the nurse loan repayment program,2012-02-08T00:00:00,2012-05-08T00:00:00,bill,Health,10605,10604
ny,2011-2012,lower,A 8389,Relates to the authority of an agent to act outside a hospital setting to make certain decisions regarding the transport of the principal,2011-06-16T00:00:00,2012-10-16T00:00:00,bill,Health,10609,10608
ny,2011-2012,lower,A 83A,Provides restroom access to persons with certain medical conditions,2011-06-16T00:00:00,2012-02-17T00:00:00,bill,Health,10622,10621
